{
  "sessions": [
    {
      "id": "oasis-panel-2026-07-10",
      "title": "Ecologists Meet AI: what should the panel track first?",
      "startedAt": "2026-07-10T09:00:00-06:00",
      "endedAt": "2026-07-10T10:34:00-06:00",
      "summary": "The panel mapped early priorities for AI-assisted ecological discovery, with strong agreement on evidence traceability and open science, active disagreement about benchmark governance, and unresolved questions around foundation-model evaluation."
    }
  ],
  "agents": [
    { "id": "interaction-agent", "name": "Interaction Agent", "role": "Human-facing liaison" },
    { "id": "scientific-director", "name": "Scientific Director", "role": "Scientific framing" },
    { "id": "domain-scientist", "name": "Domain Scientist", "role": "Ecological interpretation" },
    { "id": "data-engineer", "name": "Data Engineer", "role": "Data and infrastructure" },
    { "id": "quant-modeler", "name": "Quantitative Modeler", "role": "Models and benchmarks" },
    { "id": "citation-curator", "name": "Citation and Evidence Curator", "role": "Evidence tracking" },
    { "id": "skeptic", "name": "Skeptic", "role": "Assumptions and failure modes" },
    { "id": "narrative-lead", "name": "Scientific Narrative Lead", "role": "Synthesis and communication" },
    { "id": "societal-impact", "name": "Societal Impact Translator", "role": "Ethics and impact" }
  ],
  "topics": [
    {
      "id": "evidence-traceability",
      "label": "Evidence traceability",
      "category": "evidence",
      "canonicalTags": ["evidence", "citations", "provenance"],
      "relatedTopicIds": ["open-science", "model-interpretability"],
      "status": "broad agreement"
    },
    {
      "id": "foundation-models",
      "label": "Ecological foundation models",
      "category": "models",
      "canonicalTags": ["foundation models", "species distribution", "generalization"],
      "relatedTopicIds": ["benchmarks", "remote-sensing", "data-quality"],
      "status": "unresolved"
    },
    {
      "id": "data-quality",
      "label": "Data quality and bias",
      "category": "data",
      "canonicalTags": ["dataset bias", "sampling gaps", "metadata"],
      "relatedTopicIds": ["remote-sensing", "ai-ethics"],
      "status": "active"
    },
    {
      "id": "benchmarks",
      "label": "Benchmark governance",
      "category": "governance",
      "canonicalTags": ["benchmarks", "evaluation", "governance"],
      "relatedTopicIds": ["foundation-models", "open-science"],
      "status": "disagreement"
    },
    {
      "id": "model-interpretability",
      "label": "Model interpretability",
      "category": "methods",
      "canonicalTags": ["interpretability", "mechanisms", "decision support"],
      "relatedTopicIds": ["evidence-traceability", "ai-ethics"],
      "status": "active"
    },
    {
      "id": "open-science",
      "label": "Open science workflow",
      "category": "collaboration",
      "canonicalTags": ["open science", "reproducibility", "FAIR"],
      "relatedTopicIds": ["evidence-traceability", "benchmarks"],
      "status": "broad agreement"
    },
    {
      "id": "remote-sensing",
      "label": "Remote sensing",
      "category": "data",
      "canonicalTags": ["remote sensing", "imagery", "earth observation"],
      "relatedTopicIds": ["foundation-models", "data-quality"],
      "status": "low engagement"
    },
    {
      "id": "agent-governance",
      "label": "Agent governance",
      "category": "infrastructure",
      "canonicalTags": ["agent governance", "approval gates", "audit"],
      "relatedTopicIds": ["open-science", "ai-ethics"],
      "status": "low engagement"
    },
    {
      "id": "ai-ethics",
      "label": "AI ethics and sovereignty",
      "category": "ethics",
      "canonicalTags": ["ethics", "data sovereignty", "community review"],
      "relatedTopicIds": ["data-quality", "agent-governance"],
      "status": "active"
    }
  ],
  "events": [
    {
      "id": "evt-001",
      "sessionId": "oasis-panel-2026-07-10",
      "timestamp": "2026-07-10T09:02:00-06:00",
      "agentId": "interaction-agent",
      "agentName": "Interaction Agent",
      "summary": "Opened the session by asking which discussion records should be publishable to the website.",
      "topicTags": ["open-science", "agent-governance"],
      "stance": "clarification",
      "contributionType": "question",
      "status": "newly raised"
    },
    {
      "id": "evt-002",
      "sessionId": "oasis-panel-2026-07-10",
      "timestamp": "2026-07-10T09:06:00-06:00",
      "agentId": "citation-curator",
      "agentName": "Citation and Evidence Curator",
      "summary": "Proposed that every factual claim promoted to the site must link to evidence or be marked as speculation.",
      "topicTags": ["evidence-traceability", "open-science"],
      "stance": "agree",
      "contributionType": "proposal",
      "confidence": 0.91,
      "evidenceRefs": ["EVIDENCE_LEDGER.yaml"]
    },
    {
      "id": "evt-003",
      "sessionId": "oasis-panel-2026-07-10",
      "timestamp": "2026-07-10T09:10:00-06:00",
      "agentId": "scientific-director",
      "agentName": "Scientific Director",
      "summary": "Agreed that traceability should be a first-class panel norm because it lets readers separate evidence from synthesis.",
      "topicTags": ["evidence-traceability"],
      "stance": "agree",
      "contributionType": "norm",
      "relatedEventIds": ["evt-002"],
      "confidence": 0.88,
      "status": "accepted"
    },
    {
      "id": "evt-004",
      "sessionId": "oasis-panel-2026-07-10",
      "timestamp": "2026-07-10T09:14:00-06:00",
      "agentId": "skeptic",
      "agentName": "Skeptic",
      "summary": "Warned that citation density can create false confidence if evidence quality is not assessed.",
      "topicTags": ["evidence-traceability", "data-quality"],
      "stance": "clarification",
      "contributionType": "claim",
      "confidence": 0.82
    },
    {
      "id": "evt-005",
      "sessionId": "oasis-panel-2026-07-10",
      "timestamp": "2026-07-10T09:19:00-06:00",
      "agentId": "data-engineer",
      "agentName": "Data Engineer",
      "summary": "Identified sampling gaps, inconsistent metadata, and inconsistent taxonomies as immediate blockers for ecological AI workflows.",
      "topicTags": ["data-quality"],
      "stance": "neutral",
      "contributionType": "evidence",
      "confidence": 0.79,
      "evidenceRefs": ["DATA_MANIFEST.md", "storage/storage.yml"]
    },
    {
      "id": "evt-006",
      "sessionId": "oasis-panel-2026-07-10",
      "timestamp": "2026-07-10T09:24:00-06:00",
      "agentId": "domain-scientist",
      "agentName": "Domain Scientist",
      "summary": "Asked whether foundation models are discovering ecological mechanisms or mostly interpolating known observational patterns.",
      "topicTags": ["foundation-models", "model-interpretability"],
      "stance": "unresolved",
      "contributionType": "question",
      "status": "actively discussed"
    },
    {
      "id": "evt-007",
      "sessionId": "oasis-panel-2026-07-10",
      "timestamp": "2026-07-10T09:29:00-06:00",
      "agentId": "quant-modeler",
      "agentName": "Quantitative Modeler",
      "summary": "Argued that foundation models can be useful discovery tools if evaluation includes transfer, perturbation tests, and counterfactual checks.",
      "topicTags": ["foundation-models", "benchmarks"],
      "stance": "agree",
      "contributionType": "claim",
      "confidence": 0.74
    },
    {
      "id": "evt-008",
      "sessionId": "oasis-panel-2026-07-10",
      "timestamp": "2026-07-10T09:34:00-06:00",
      "agentId": "skeptic",
      "agentName": "Skeptic",
      "summary": "Disagreed that benchmark performance alone should be treated as evidence of ecological discovery.",
      "topicTags": ["foundation-models", "benchmarks", "model-interpretability"],
      "stance": "disagree",
      "contributionType": "claim",
      "relatedEventIds": ["evt-007"],
      "confidence": 0.86
    },
    {
      "id": "evt-009",
      "sessionId": "oasis-panel-2026-07-10",
      "timestamp": "2026-07-10T09:39:00-06:00",
      "agentId": "societal-impact",
      "agentName": "Societal Impact Translator",
      "summary": "Raised concern that benchmark choices can privilege well-instrumented ecosystems and marginalize community-held knowledge.",
      "topicTags": ["benchmarks", "ai-ethics", "data-quality"],
      "stance": "disagree",
      "contributionType": "claim",
      "confidence": 0.8
    },
    {
      "id": "evt-010",
      "sessionId": "oasis-panel-2026-07-10",
      "timestamp": "2026-07-10T09:44:00-06:00",
      "agentId": "scientific-director",
      "agentName": "Scientific Director",
      "summary": "Proposed that benchmark governance should include domain experts, data stewards, and community review where data sovereignty is relevant.",
      "topicTags": ["benchmarks", "ai-ethics", "open-science"],
      "stance": "agree",
      "contributionType": "proposal",
      "confidence": 0.83
    },
    {
      "id": "evt-011",
      "sessionId": "oasis-panel-2026-07-10",
      "timestamp": "2026-07-10T09:48:00-06:00",
      "agentId": "narrative-lead",
      "agentName": "Scientific Narrative Lead",
      "summary": "Summarized the split: benchmarks are necessary for comparison but insufficient as a definition of discovery.",
      "topicTags": ["benchmarks", "foundation-models"],
      "stance": "neutral",
      "contributionType": "summary",
      "relatedEventIds": ["evt-007", "evt-008", "evt-009", "evt-010"]
    },
    {
      "id": "evt-012",
      "sessionId": "oasis-panel-2026-07-10",
      "timestamp": "2026-07-10T09:52:00-06:00",
      "agentId": "interaction-agent",
      "agentName": "Interaction Agent",
      "summary": "Queued a follow-up discussion on how to score interpretability without overclaiming mechanism.",